{"run":48,"commit":"6d4f64a","metric":283.0,"metrics":{"focused_checks_green":283,"focused_json_tests":13,"focused_toml_tests":11,"focused_shell_tests":12,"focused_datetime_tests":8,"focused_base64_tests":13,"focused_crypto_tests":13,"focused_http_tests":0,"focused_uuid_tests":7,"focused_yaml_tests":11,"focused_env_tests":13,"focused_url_tests":17,"focused_path_tests":14,"focused_file_tests":12,"focused_math_tests":20,"focused_regex_tests":17,"focused_random_tests":11,"focused_logger_tests":15,"focused_csv_tests":17,"focused_store_tests":15,"focused_bitwise_tests":13,"focused_hex_tests":12,"focused_access_tests":19,"display":"283/283","exit_code":0,"duration_seconds":0.36,"checks":"passed","cargo_pass":807,"cargo_fail":1,"cargo_ignored":1,"failing_test":"interop::string_mod::tests::str_to_float_parses_float"},"status":"keep","description":"Added Access.get_in/2, Access.put_in/3, Access.fetch/2, Access.keys/1 for nested data traversal with 19 focused unit tests.","timestamp":1774597200000,"segment":2}
{"run":49,"commit":"8453545","metric":311.0,"metrics":{"focused_checks_green":311,"focused_json_tests":13,"focused_toml_tests":11,"focused_shell_tests":12,"focused_datetime_tests":8,"focused_base64_tests":13,"focused_crypto_tests":13,"focused_http_tests":0,"focused_uuid_tests":7,"focused_yaml_tests":11,"focused_env_tests":13,"focused_url_tests":17,"focused_path_tests":14,"focused_file_tests":12,"focused_math_tests":20,"focused_regex_tests":17,"focused_random_tests":11,"focused_logger_tests":15,"focused_csv_tests":17,"focused_store_tests":15,"focused_bitwise_tests":13,"focused_hex_tests":12,"focused_access_tests":19,"focused_integer_tests":28,"display":"311/311","exit_code":0,"duration_seconds":0.36,"checks":"passed","cargo_pass":835,"cargo_fail":1,"cargo_ignored":1,"failing_test":"interop::string_mod::tests::str_to_float_parses_float"},"status":"keep","description":"Extended Integer stdlib with to_string/2 (base conversion), digits/1, undigits/1, gcd/2, is_even/1, is_odd/1, pow/2 — 28 focused unit tests total.","timestamp":1774597800000,"segment":2}
{"run":50,"commit":"3edf0e4","metric":20.0,"metrics":{"focused_checks_green":20,"focused_cli_tests":20,"display":"20/20","exit_code":0,"duration_seconds":0.36,"checks":"passed","cargo_pass":855,"cargo_fail":1,"cargo_ignored":1,"failing_test":"interop::string_mod::tests::str_to_float_parses_float"},"status":"keep","description":"Implemented CLI.spec/1, CLI.parse/2, CLI.help_text/1, CLI.output/2, CLI.exit_error/1 with auto --help, --version, --output-json, flag types, short aliases, positional args, and 20 focused unit tests.","timestamp":1774620000000,"segment":3}
{"run":51,"commit":"5671856","metric":32.0,"metrics":{"focused_checks_green":32,"focused_cli_tests":32,"display":"32/32","exit_code":0,"duration_seconds":0.36,"checks":"passed","cargo_pass":867,"cargo_fail":1,"cargo_ignored":1,"failing_test":"interop::string_mod::tests::str_to_float_parses_float"},"status":"keep","description":"Added subcommand support to CLI module with commands: spec key, per-command flags/args, root and command-specific help, unknown/missing command errors, --output-json inheritance, and 12 focused unit tests.","timestamp":1774620600000,"segment":3}
{"run": 52, "commit": "eeffc52", "metric": 48.0, "metrics": {"focused_checks_green": 48, "focused_cli_tests": 48, "display": "48/48", "exit_code": 0, "duration_seconds": 0.36, "checks": "passed", "cargo_pass": 883, "cargo_fail": 1, "cargo_ignored": 1, "failing_test": "interop::string_mod::tests::str_to_float_parses_float"}, "status": "keep", "description": "Added flag choices constraint, env variable fallback, and multi-value flags to CLI module with 16 focused unit tests.", "timestamp": 1774621200000, "segment": 3}
{"run":53,"commit":"6b3d477","metric":61.0,"metrics":{"focused_checks_green":61,"focused_cli_tests":61,"display":"61/61","exit_code":0,"duration_seconds":0.35,"checks":"passed","cargo_pass":896,"cargo_fail":1,"cargo_ignored":1,"failing_test":"interop::string_mod::tests::str_to_float_parses_float"},"status":"keep","description":"Added required flags, negatable booleans, hidden flags/commands, and command aliases to CLI module with 13 focused unit tests.","timestamp":1774622400000,"segment":3}
{"run":54,"commit":"aead642","metric":77.0,"metrics":{"focused_checks_green":77,"focused_cli_tests":77,"display":"77/77","exit_code":0,"duration_seconds":0.35,"checks":"passed","cargo_pass":912,"cargo_fail":1,"cargo_ignored":1,"failing_test":"interop::string_mod::tests::str_to_float_parses_float"},"status":"keep","description":"Added equals syntax, pass-through args, global flags, flag conflicts_with, and flag requires to CLI module with 16 focused unit tests.","timestamp":1774623000000,"segment":3}
{"run":55,"commit":"3b59725","metric":92.0,"metrics":{"focused_checks_green":92,"focused_cli_tests":92,"display":"92/92","exit_code":0,"duration_seconds":0.34,"checks":"passed","cargo_pass":927,"cargo_fail":1,"cargo_ignored":1,"failing_test":"interop::string_mod::tests::str_to_float_parses_float"},"status":"keep","description":"Added combined short flags, typed positional args, value name customization, and help examples section with 15 focused unit tests.","timestamp":1774623914000,"segment":3}
