{"run":1,"commit":"","metric":6.0,"metrics":{"covered_checks":6,"total_checks":6,"display":"6/6","exit_code":0,"duration_seconds":0.34,"checks":"passed","cargo_pass":455,"cargo_fail":1,"cargo_ignored":1,"failing_test":"interop::string_mod::tests::str_to_float_parses_float"},"status":"keep","description":"Added E0003 missing-end EOF diagnostics anchored to opening construct spans, plus parser/CLI coverage for missing module/function/if end cases.","timestamp":1774051790147,"segment":0}
{"run":2,"commit":"","metric":8.0,"metrics":{"covered_checks":8,"total_checks":8,"display":"8/8","exit_code":0,"duration_seconds":0.28,"checks":"passed","cargo_pass":456,"cargo_fail":1,"cargo_ignored":1,"failing_test":"interop::string_mod::tests::str_to_float_parses_float"},"status":"keep","description":"Added E0004 unexpected-arrow parser diagnostics with fix hints, plus parser/CLI coverage for bare arrow outside branch contexts.","timestamp":1774056120000,"segment":0}
{"run":3,"commit":"","metric":12.0,"metrics":{"covered_checks":12,"total_checks":12,"display":"12/12","exit_code":0,"duration_seconds":0.31,"checks":"passed","cargo_pass":458,"cargo_fail":1,"cargo_ignored":1,"failing_test":"interop::string_mod::tests::str_to_float_parses_float"},"status":"keep","description":"Added E0005 stray block keyword parser diagnostics with fix hints, plus parser/CLI coverage for stray else/rescue cases.","timestamp":1774053061246,"segment":0}
{"run":4,"commit":"","metric":20.0,"metrics":{"covered_checks":20,"total_checks":20,"display":"20/20","exit_code":0,"duration_seconds":0.32674479484558105,"checks":"passed","cargo_pass":463,"cargo_fail":1,"cargo_ignored":1,"failing_test":"interop::string_mod::tests::str_to_float_parses_float"},"status":"keep","description":"Added E0006 missing-do parser diagnostics anchored to block-opening spans, plus parser/CLI coverage for representative missing-do cases.","timestamp":1774053733628,"segment":0}
{"run":5,"commit":"","metric":27.0,"metrics":{"covered_checks":27,"total_checks":27,"display":"27/27","exit_code":0,"duration_seconds":0.35,"checks":"passed","cargo_pass":467,"cargo_fail":1,"cargo_ignored":1,"failing_test":"interop::string_mod::tests::str_to_float_parses_float"},"status":"keep","description":"Added E0007 missing-arrow clause diagnostics anchored to clause starts, plus parser/CLI coverage for representative case/rescue/fn missing-arrow failures.","timestamp":1774054349968,"segment":0}
{"run":6,"commit":"d2fc2f3","metric":34.0,"metrics":{"covered_checks":34,"total_checks":34,"display":"34/34","exit_code":0,"duration_seconds":0.2747058868408203,"checks":"passed","cargo_pass":470,"cargo_fail":2,"cargo_ignored":1,"failing_test":"interop::string_mod::tests::str_to_float_parses_float,typing::tests::infer_types_accepts_dynamic_operands_for_arithmetic"},"status":"discard","description":"Tried actionable E2001 operator mismatch diagnostics across arithmetic/comparison/unary-minus/integer-only operators, but regressed dynamic arithmetic typing semantics.","timestamp":1774055240809,"segment":0}
{"run":7,"commit":"","metric":35.0,"metrics":{"covered_checks":35,"total_checks":35,"display":"35/35","exit_code":0,"duration_seconds":0.54,"checks":"passed","cargo_pass":468,"cargo_fail":1,"cargo_ignored":1,"failing_test":"interop::string_mod::tests::str_to_float_parses_float"},"status":"keep","description":"Added diagnostic-only E2001 bool/atom mismatch hints on existing typing failure paths, plus representative typing/CLI coverage.","timestamp":1774055899139,"segment":0}
{"run":8,"commit":"","metric":40.0,"metrics":{"covered_checks":40,"total_checks":40,"display":"40/40","exit_code":0,"duration_seconds":12.88,"checks":"passed","cargo_pass":469,"cargo_fail":1,"cargo_ignored":1,"failing_test":"interop::string_mod::tests::str_to_float_parses_float"},"status":"keep","description":"Added actionable E3001/E3002 typing hints on existing failure paths, plus representative typing/CLI coverage.","timestamp":1774056454353,"segment":0}
{"run": 9, "commit": "", "metric": 49.0, "metrics": {"covered_checks": 49, "total_checks": 49, "display": "49/49", "exit_code": 0, "duration_seconds": 3.69, "checks": "passed", "cargo_pass": 473, "cargo_fail": 1, "cargo_ignored": 1, "failing_test": "interop::string_mod::tests::str_to_float_parses_float"}, "status": "keep", "description": "Added diagnostic-only E2002 arity mismatch hints with source locations for user-defined, builtin, guard, and capture call failures, plus representative typing/CLI coverage.", "timestamp": 1774057324654, "segment": 0}
{"run":10,"commit":"","metric":79.0,"metrics":{"covered_checks":79,"total_checks":79,"display":"79/79","exit_code":0,"duration_seconds":4.757880210876465,"checks":"passed","cargo_pass":478,"cargo_fail":1,"cargo_ignored":1,"failing_test":"interop::string_mod::tests::str_to_float_parses_float"},"status":"keep","description":"Added diagnostic-only E1001 undefined-symbol suggestion plumbing for local/imported/module-qualified call typos, plus representative resolver/CLI coverage.","timestamp":1774058183332,"segment":0}
{"run":11,"commit":"","metric":84.0,"metrics":{"covered_checks":84,"total_checks":84,"display":"84/84","exit_code":0,"duration_seconds":2.74,"checks":"passed","cargo_pass":479,"cargo_fail":1,"cargo_ignored":1,"failing_test":"interop::string_mod::tests::str_to_float_parses_float"},"status":"keep","description":"Added shared parser-side E0008 missing-map-entry separator diagnostics for map literals and patterns, plus representative parser/CLI coverage.","timestamp":1774058799778,"segment":0}
{"run":12,"commit":"","metric":91.0,"metrics":{"covered_checks":91,"total_checks":91,"display":"91/91","exit_code":0,"duration_seconds":3.39,"checks":"passed","cargo_pass":483,"cargo_fail":1,"cargo_ignored":1,"failing_test":"interop::string_mod::tests::str_to_float_parses_float"},"status":"keep","description":"Added parser-side E0009 capture and anonymous-function diagnostics with repair hints, plus representative parser/CLI coverage.","timestamp":1774059635198,"segment":0}
{"run":13,"commit":"","metric":100.0,"metrics":{"covered_checks":100,"total_checks":100,"display":"100/100","exit_code":0,"duration_seconds":3.18,"checks":"passed","cargo_pass":486,"cargo_fail":1,"cargo_ignored":1,"failing_test":"interop::string_mod::tests::str_to_float_parses_float"},"status":"keep","description":"Added diagnostic-only E2001 numeric operand hints on existing int-only mismatch paths, plus representative typing/CLI coverage.","timestamp":1774060653843,"segment":0}
{"run":14,"commit":"","metric":108.0,"metrics":{"covered_checks":108,"total_checks":108,"display":"108/108","exit_code":0,"duration_seconds":3.43,"checks":"passed","cargo_pass":490,"cargo_fail":1,"cargo_ignored":1,"failing_test":"interop::string_mod::tests::str_to_float_parses_float"},"status":"keep","description":"Added parser-side E0010 missing-comma diagnostics for call arguments and function/protocol parameter lists, plus representative parser/CLI coverage.","timestamp":1774061472940,"segment":0}
{"run":15,"commit":"","metric":114.0,"metrics":{"covered_checks":114,"total_checks":114,"display":"114/114","exit_code":0,"duration_seconds":0.3,"checks":"passed","cargo_pass":493,"cargo_fail":1,"cargo_ignored":1,"failing_test":"interop::string_mod::tests::str_to_float_parses_float"},"status":"keep","description":"Extended parser-side E0010 missing-comma diagnostics to with/for clause separators, plus representative parser/CLI coverage.","timestamp":1774062190421,"segment":0}
{"run":16,"commit":"","metric":128.0,"metrics":{"covered_checks":128,"total_checks":128,"display":"128/128","exit_code":0,"duration_seconds":0.28,"checks":"passed","cargo_pass":500,"cargo_fail":1,"cargo_ignored":1,"failing_test":"interop::string_mod::tests::str_to_float_parses_float"},"status":"keep","description":"Extended parser-side E0002 unclosed-delimiter diagnostics to grouped expressions, calls/captures, index access, and function/protocol parameter lists, plus representative parser/CLI coverage.","timestamp":1774062940412,"segment":0}
{"run":17,"commit":"","metric":138.0,"metrics":{"covered_checks":138,"total_checks":138,"display":"138/138","exit_code":0,"duration_seconds":3.48,"checks":"passed","cargo_pass":504,"cargo_fail":1,"cargo_ignored":1,"failing_test":"interop::string_mod::tests::str_to_float_parses_float"},"status":"keep","description":"Added parser-side E0010/E0002 bitstring separator and unclosed-delimiter diagnostics for bitstring literals and patterns, plus representative parser/CLI coverage.","timestamp":1774063578419,"segment":0}
{"run":18,"commit":"","metric":152.0,"metrics":{"covered_checks":152,"total_checks":152,"display":"152/152","exit_code":0,"duration_seconds":0.28,"checks":"passed","cargo_pass":510,"cargo_fail":1,"cargo_ignored":1,"failing_test":"interop::string_mod::tests::str_to_float_parses_float"},"status":"keep","description":"Extended parser-side E0010/E0002 diagnostics to alias child lists, import filter lists, and structured raise keyword arguments, plus representative parser/CLI coverage.","timestamp":1774064336382,"segment":0}
{"run":19,"commit":"","metric":166.0,"metrics":{"covered_checks":166,"total_checks":166,"display":"166/166","exit_code":0,"duration_seconds":0.3688499927520752,"checks":"passed","cargo_pass":523,"cargo_fail":1,"cargo_ignored":1,"failing_test":"interop::string_mod::tests::str_to_float_parses_float"},"status":"keep","description":"Extended parser-side E0010/E0002 diagnostics to remaining tuple/list/keyword/map/struct literal and pattern delimiter/separator failures, plus representative parser/CLI coverage.","timestamp":1774065159488,"segment":0}
{"run": 20, "commit": "", "metric": 14.0, "metrics": {"focused_checks_green": 14, "focused_bin_tests": 12, "focused_integration_tests": 2, "display": "14/14", "exit_code": 0, "duration_seconds": 7.813609, "checks": "passed"}, "judge_score": 8.0, "judge_pass": true, "judge_detail": {"code_quality": {"score": 8, "rationale": "Shared ReplSession state and focused server tests make the new remote REPL slice coherent and verifiable, though the transport is still a minimal newline-delimited JSON protocol rather than fuller nREPL semantics."}}, "status": "keep", "description": "Extracted a shared ReplSession core and added tonic repl --listen with JSON/TCP eval, clear, and load-file operations plus focused server coverage.", "timestamp": 1774554811051, "segment": 1}
{"run": 21, "commit": "", "metric": 16.0, "metrics": {"focused_checks_green": 16, "focused_bin_tests": 13, "focused_integration_tests": 3, "display": "16/16", "exit_code": 0, "duration_seconds": 5.753112, "checks": "passed"}, "judge_score": 8.0, "judge_pass": true, "judge_detail": {"code_quality": {"score": 8, "rationale": "The logical-session layer cleanly extends the prior REPL server with reconnect, clone, and close behavior while keeping the implementation small and well-covered, though the protocol is still a minimal in-memory JSON/TCP substrate rather than fuller nREPL semantics."}}, "status": "keep", "description": "Added server-wide logical REPL session ids with session-addressed eval/clear/load-file plus clone/close lifecycle ops and focused reconnect coverage.", "timestamp": 1774560937000, "segment": 1}
{"run": 22, "commit": "", "metric": 18.0, "metrics": {"focused_checks_green": 18, "focused_bin_tests": 14, "focused_integration_tests": 4, "display": "18/18", "exit_code": 0, "duration_seconds": 6.68, "checks": "passed"}, "judge_score": 8.0, "judge_pass": true, "judge_detail": {"code_quality": {"score": 8, "rationale": "The describe op fits the existing REPL server cleanly, advertises capabilities in a compact schema, and is backed by focused unit and TCP integration coverage, though it is still a minimal custom protocol slice rather than fuller nREPL semantics."}}, "status": "keep", "description": "Added a describe op that advertises supported remote REPL ops plus logical-session semantics, with focused unit and TCP integration coverage.", "timestamp": 1774556032374, "segment": 1}
{"run": 23, "commit": "", "metric": 20.0, "metrics": {"focused_checks_green": 20, "focused_bin_tests": 15, "focused_integration_tests": 5, "display": "20/20", "exit_code": 0, "duration_seconds": 8.47, "checks": "passed"}, "judge_score": 8.0, "judge_pass": true, "judge_detail": {"code_quality": {"score": 8, "rationale": "The output-capture slice is a clean, focused extension of the existing REPL server: it centralizes host stdout/stderr routing in shared interop helpers, threads captured output into eval/load-file responses without widening scope, and adds focused unit plus TCP integration coverage, though it still stops short of fuller nREPL stream semantics like async output or interrupts."}}, "status": "keep", "description": "Routed host-side stdout/stderr through a scoped interop capture sink and surfaced captured output in remote eval/load-file responses, with focused unit and TCP integration coverage.", "timestamp": 1774557028516, "segment": 1}
{"run": 24, "commit": "", "metric": 24.0, "metrics": {"focused_checks_green": 24, "focused_bin_tests": 17, "focused_integration_tests": 7, "display": "24/24", "exit_code": 0, "duration_seconds": 9.22, "checks": "passed"}, "judge_score": 8.0, "judge_pass": true, "judge_detail": {"code_quality": {"score": 8, "rationale": "The request-scoped stdin slice fits the existing remote REPL design cleanly: it adds a small scoped input stack alongside the prior output capture, threads optional stdin through eval/load-file and describe without widening scope, and backs the behavior with focused unit plus TCP integration coverage, though it still stops short of fuller nREPL interaction semantics like async streams or interrupts."}}, "status": "keep", "description": "Added request-scoped stdin plumbing for remote eval/load-file, threading optional JSON stdin through scoped interop input capture and focused unit plus TCP integration coverage for connection-local and logical sessions.", "timestamp": 1774558134324, "segment": 1}
{"run": 25, "commit": "", "metric": 28.0, "metrics": {"focused_checks_green": 28, "focused_bin_tests": 19, "focused_integration_tests": 9, "display": "28/28", "exit_code": 0, "duration_seconds": 0.27, "checks": "passed"}, "judge_score": 8.0, "judge_pass": true, "judge_detail": {"code_quality": {"score": 8, "rationale": "Request ids and streamed stdout/stderr frames extend the remote REPL cleanly through shared interop sinks and focused unit/TCP coverage, but the protocol remains a minimal custom JSON/TCP layer rather than fuller nREPL semantics like interrupts or richer async messaging."}}, "status": "keep", "description": "Added optional request ids plus streamed stdout/stderr frames for remote eval/load-file, echoing ids in terminal responses and covering connection-local and logical-session streaming.", "timestamp": 1774569300000, "segment": 1}
{"run":26,"commit":"03c77d3","metric":6.0,"metrics":{"focused_checks_green":6,"focused_assert_tests":6,"focused_integration_tests":21,"display":"6/6","exit_code":0,"duration_seconds":0.04,"checks":"passed","cargo_pass":533,"cargo_fail":1,"cargo_ignored":1,"failing_test":"interop::string_mod::tests::str_to_float_parses_float"},"status":"keep","description":"Added built-in Assert stdlib module with assert/refute/assert_equal/assert_not_equal host functions producing structured assertion failures, plus stdlib injection into test runner and 6 focused integration tests.","timestamp":1774576074000,"segment":2}
{"run":27,"commit":"7f666c4","metric":9.0,"metrics":{"focused_checks_green":9,"focused_assert_tests":6,"focused_filter_tests":3,"focused_integration_tests":24,"display":"9/9","exit_code":0,"duration_seconds":0.04,"checks":"passed","cargo_pass":533,"cargo_fail":1,"cargo_ignored":1,"failing_test":"interop::string_mod::tests::str_to_float_parses_float"},"status":"keep","description":"Added --filter <pattern> for tonic test that substring-matches against test names, with 3 focused integration tests for subset match, no match, and JSON+filter.","timestamp":1774576800000,"segment":2}
{"run":28,"commit":"ea6d8da","metric":9.0,"metrics":{"focused_checks_green":9,"focused_assert_tests":6,"focused_filter_tests":3,"focused_integration_tests":24,"display":"9/9","exit_code":0,"duration_seconds":0.04,"checks":"passed","cargo_pass":533,"cargo_fail":1,"cargo_ignored":1,"failing_test":"interop::string_mod::tests::str_to_float_parses_float","timing_feature":"validated_in_json_and_text_output_tests"},"status":"keep","description":"Added per-test and total run timing to tonic test, showing durations in text output and duration_ms fields in JSON output, with timing validation integrated into existing test assertions.","timestamp":1774577400000,"segment":2}
{"run":29,"commit":"3bf92d4","metric":12.0,"metrics":{"focused_checks_green":12,"focused_assert_tests":6,"focused_filter_tests":3,"focused_failure_summary_tests":3,"focused_integration_tests":27,"display":"12/12","exit_code":0,"duration_seconds":0.04,"checks":"passed","cargo_pass":533,"cargo_fail":1,"cargo_ignored":1,"failing_test":"interop::string_mod::tests::str_to_float_parses_float"},"status":"keep","description":"Added failure summary section to text and JSON output, grouping failed tests at end with numbered list and full errors, plus 3 focused integration tests.","timestamp":1774577800000,"segment":2}
{"run":30,"commit":"b85be98","metric":15.0,"metrics":{"focused_checks_green":15,"focused_assert_tests":6,"focused_filter_tests":3,"focused_failure_summary_tests":3,"focused_list_tests":3,"focused_integration_tests":30,"display":"15/15","exit_code":0,"duration_seconds":0.04,"checks":"passed","cargo_pass":533,"cargo_fail":1,"cargo_ignored":1,"failing_test":"interop::string_mod::tests::str_to_float_parses_float"},"status":"keep","description":"Added --list flag for test discovery without execution, with text/JSON output and filter combination, plus 3 focused integration tests.","timestamp":1774578200000,"segment":2}
{"run":31,"commit":"38ba47d","metric":19.0,"metrics":{"focused_checks_green":19,"focused_assert_tests":10,"focused_filter_tests":3,"focused_failure_summary_tests":3,"focused_list_tests":3,"focused_integration_tests":34,"display":"19/19","exit_code":0,"duration_seconds":0.04,"checks":"passed","cargo_pass":533,"cargo_fail":1,"cargo_ignored":1,"failing_test":"interop::string_mod::tests::str_to_float_parses_float"},"status":"keep","description":"Added assert_contains (string substring + list membership) and assert_in_delta (numeric proximity) to Assert stdlib module, with structured failure rendering and 4 focused integration tests.","timestamp":1774578132000,"segment":2}
{"run":32,"commit":"81c1ab1","metric":22.0,"metrics":{"focused_checks_green":22,"focused_assert_tests":10,"focused_filter_tests":3,"focused_failure_summary_tests":3,"focused_list_tests":3,"focused_fail_fast_tests":3,"focused_integration_tests":37,"display":"22/22","exit_code":0,"duration_seconds":0.04,"checks":"passed","cargo_pass":533,"cargo_fail":1,"cargo_ignored":1,"failing_test":"interop::string_mod::tests::str_to_float_parses_float"},"status":"keep","description":"Added --fail-fast flag to tonic test that stops execution after first failure, with labeled loop breaks and 3 focused integration tests.","timestamp":1774578489000,"segment":2}
{"run":33,"commit":"fc9e71d","metric":25.0,"metrics":{"focused_checks_green":25,"focused_assert_tests":10,"focused_filter_tests":3,"focused_failure_summary_tests":3,"focused_list_tests":3,"focused_fail_fast_tests":3,"focused_color_tests":3,"focused_integration_tests":40,"display":"25/25","exit_code":0,"duration_seconds":0.04,"checks":"passed","cargo_pass":533,"cargo_fail":1,"cargo_ignored":1,"failing_test":"interop::string_mod::tests::str_to_float_parses_float"},"status":"keep","description":"Added ANSI colored output to tonic test with NO_COLOR env var support, plus 3 focused integration tests for color presence, NO_COLOR stripping, and JSON ANSI-free.","timestamp":1774578900000,"segment":2}
{"run":34,"commit":"c528923","metric":28.0,"metrics":{"focused_checks_green":28,"focused_assert_tests":10,"focused_filter_tests":3,"focused_failure_summary_tests":3,"focused_list_tests":3,"focused_fail_fast_tests":3,"focused_color_tests":3,"focused_seed_tests":3,"focused_integration_tests":43,"display":"28/28","exit_code":0,"duration_seconds":0.04,"checks":"passed","cargo_pass":533,"cargo_fail":1,"cargo_ignored":1,"failing_test":"interop::string_mod::tests::str_to_float_parses_float"},"status":"keep","description":"Added --seed flag for reproducible randomized test ordering using splitmix64 PRNG and Fisher-Yates shuffle, with 3 focused integration tests.","timestamp":1774579200000,"segment":2}
{"run":35,"commit":"9d912ab","metric":31.0,"metrics":{"focused_checks_green":31,"focused_assert_tests":10,"focused_filter_tests":3,"focused_failure_summary_tests":3,"focused_list_tests":3,"focused_fail_fast_tests":3,"focused_color_tests":3,"focused_seed_tests":3,"focused_setup_tests":3,"focused_integration_tests":46,"display":"31/31","exit_code":0,"duration_seconds":0.05,"checks":"passed","cargo_pass":533,"cargo_fail":1,"cargo_ignored":1,"failing_test":"interop::string_mod::tests::str_to_float_parses_float"},"status":"keep","description":"Added setup/0 function support for test modules — optional setup runs before each test, with setup failure handling and 3 focused integration tests.","timestamp":1774579982000,"segment":2}
