{"run":36,"commit":"c05fc04","metric":34.0,"metrics":{"focused_checks_green":34,"focused_assert_tests":10,"focused_filter_tests":3,"focused_failure_summary_tests":3,"focused_list_tests":3,"focused_fail_fast_tests":3,"focused_color_tests":3,"focused_seed_tests":3,"focused_setup_tests":3,"focused_skip_tests":3,"focused_integration_tests":49,"display":"34/34","exit_code":0,"duration_seconds":0.05,"checks":"passed","cargo_pass":533,"cargo_fail":1,"cargo_ignored":1,"failing_test":"interop::string_mod::tests::str_to_float_parses_float"},"status":"keep","description":"Added Assert.skip/0-1 for pending/skipped tests with yellow status, optional reason, skip+fail-fast interaction, and 3 focused integration tests.","timestamp":1774580470000,"segment":2}
{"run":37,"commit":"b0f685a","metric":37.0,"metrics":{"focused_checks_green":37,"focused_assert_tests":10,"focused_filter_tests":3,"focused_failure_summary_tests":3,"focused_list_tests":3,"focused_fail_fast_tests":3,"focused_color_tests":3,"focused_seed_tests":3,"focused_setup_tests":3,"focused_skip_tests":3,"focused_raises_tests":3,"focused_integration_tests":52,"display":"37/37","exit_code":0,"duration_seconds":0.05,"checks":"passed","cargo_pass":533,"cargo_fail":1,"cargo_ignored":1,"failing_test":"interop::string_mod::tests::str_to_float_parses_float"},"status":"keep","description":"Added Assert.assert_raises/1-2 for testing error conditions with pure Tonic try/rescue implementation, optional pattern matching, and 3 focused integration tests.","timestamp":1774581000000,"segment":2}
{"run":38,"commit":"faeada8","metric":40.0,"metrics":{"focused_checks_green":40,"focused_assert_tests":10,"focused_filter_tests":3,"focused_failure_summary_tests":3,"focused_list_tests":3,"focused_fail_fast_tests":3,"focused_color_tests":3,"focused_seed_tests":3,"focused_setup_tests":3,"focused_skip_tests":3,"focused_raises_tests":3,"focused_match_tests":3,"focused_integration_tests":55,"display":"40/40","exit_code":0,"duration_seconds":0.05,"checks":"passed","cargo_pass":533,"cargo_fail":1,"cargo_ignored":1,"failing_test":"interop::string_mod::tests::str_to_float_parses_float"},"status":"keep","description":"Added Assert.assert_match/2-3 for map subset matching with structured failure rendering for missing/mismatched keys, non-map equality fallback, and 3 focused integration tests.","timestamp":1774581600000,"segment":2}
{"run":39,"commit":"5058966","metric":43.0,"metrics":{"focused_checks_green":43,"focused_assert_tests":10,"focused_filter_tests":3,"focused_failure_summary_tests":3,"focused_list_tests":3,"focused_fail_fast_tests":3,"focused_color_tests":3,"focused_seed_tests":3,"focused_setup_tests":3,"focused_skip_tests":3,"focused_raises_tests":3,"focused_match_tests":3,"focused_timeout_tests":3,"focused_integration_tests":58,"display":"43/43","exit_code":0,"duration_seconds":0.26,"checks":"passed","cargo_pass":533,"cargo_fail":1,"cargo_ignored":1,"failing_test":"interop::string_mod::tests::str_to_float_parses_float"},"status":"keep","description":"Added --timeout <ms> flag for per-test execution timeouts using thread spawn + mpsc::recv_timeout, with 3 focused integration tests.","timestamp":1774582200000,"segment":2}
{"run":40,"commit":"b3df0a2","metric":46.0,"metrics":{"focused_checks_green":46,"focused_assert_tests":10,"focused_filter_tests":3,"focused_failure_summary_tests":3,"focused_list_tests":3,"focused_fail_fast_tests":3,"focused_color_tests":3,"focused_seed_tests":3,"focused_setup_tests":3,"focused_skip_tests":3,"focused_raises_tests":3,"focused_match_tests":3,"focused_timeout_tests":3,"focused_teardown_tests":3,"focused_integration_tests":61,"display":"46/46","exit_code":0,"duration_seconds":0.26,"checks":"passed","cargo_pass":533,"cargo_fail":1,"cargo_ignored":1,"failing_test":"interop::string_mod::tests::str_to_float_parses_float"},"status":"keep","description":"Added teardown/0 function support for test modules — runs after each test regardless of outcome, teardown failures mark passing tests as failed, plus 3 focused integration tests.","timestamp":1774582800000,"segment":2}
{"run":41,"commit":"f792340","metric":46.0,"metrics":{"focused_checks_green":46,"focused_integration_tests":61,"display":"46/46 (unchanged)","exit_code":0,"checks":"passed","cargo_pass":533,"cargo_fail":1,"cargo_ignored":1},"status":"discard","description":"Attempted Assert.capture_io/1 for testing code that produces output — added host_capture_io_start/stop functions and stdlib wrapper but no integration tests were added, leaving the primary metric unchanged at 46.","timestamp":1774583400000,"segment":2}
{"run":26,"commit":"01694e2","metric":14.0,"metrics":{"focused_checks_green":14,"focused_bin_tests":14,"focused_integration_tests":0,"display":"14/14","exit_code":0,"duration_seconds":0.34,"checks":"passed","cargo_pass":546,"cargo_fail":1,"cargo_ignored":1,"failing_test":"interop::string_mod::tests::str_to_float_parses_float"},"status":"keep","description":"Added Json.encode/1, Json.decode/1, Json.encode_pretty/1 stdlib module backed by serde_json with 14 focused unit tests.","timestamp":1774584247000,"segment":2}
{"run": 27, "commit": "c189f3a", "metric": 25.0, "metrics": {"focused_checks_green": 25, "focused_json_tests": 14, "focused_toml_tests": 11, "display": "25/25", "exit_code": 0, "duration_seconds": 0.34, "checks": "passed", "cargo_pass": 557, "cargo_fail": 1, "cargo_ignored": 1, "failing_test": "interop::string_mod::tests::str_to_float_parses_float"}, "status": "keep", "description": "Added Toml.encode/1 and Toml.decode/1 stdlib module backed by toml crate with 11 focused unit tests.", "timestamp": 1774584696590, "segment": 2}
{"run":28,"commit":"5363db1","metric":37.0,"metrics":{"focused_checks_green":37,"focused_json_tests":14,"focused_toml_tests":11,"focused_shell_tests":12,"display":"37/37","exit_code":0,"duration_seconds":0.34,"checks":"passed","cargo_pass":569,"cargo_fail":1,"cargo_ignored":1,"failing_test":"interop::string_mod::tests::str_to_float_parses_float"},"status":"keep","description":"Added Shell.quote/1 and Shell.join/1 stdlib module with POSIX single-quote wrapping and 12 focused unit tests.","timestamp":1774585145000,"segment":2}
{"run":29,"commit":"3cc8bbd","metric":45.0,"metrics":{"focused_checks_green":45,"focused_json_tests":14,"focused_toml_tests":11,"focused_shell_tests":12,"focused_datetime_tests":8,"display":"45/45","exit_code":0,"duration_seconds":0.34,"checks":"passed","cargo_pass":577,"cargo_fail":1,"cargo_ignored":1,"failing_test":"interop::string_mod::tests::str_to_float_parses_float"},"status":"keep","description":"Added DateTime.utc_now/0, DateTime.unix_now/0, DateTime.unix_now_ms/0 stdlib module backed by time crate with 8 focused unit tests.","timestamp":'1774585689000',"segment":2}
{"run":30,"commit":"7ad3eaa","metric":57.0,"metrics":{"focused_checks_green":57,"focused_json_tests":13,"focused_toml_tests":11,"focused_shell_tests":12,"focused_datetime_tests":8,"focused_base64_tests":13,"display":"57/57","exit_code":0,"duration_seconds":0.34,"checks":"passed","cargo_pass":590,"cargo_fail":1,"cargo_ignored":1,"failing_test":"interop::string_mod::tests::str_to_float_parses_float"},"status":"keep","description":"Added Base64.encode/1, Base64.decode/1, Base64.url_encode/1, Base64.url_decode/1 stdlib module backed by base64 crate with 13 focused unit tests.","timestamp":1774586100000,"segment":2}
{"run":31,"commit":"044f4e5","metric":70.0,"metrics":{"focused_checks_green":70,"focused_json_tests":13,"focused_toml_tests":11,"focused_shell_tests":12,"focused_datetime_tests":8,"focused_base64_tests":13,"focused_crypto_tests":13,"display":"70/70","exit_code":0,"duration_seconds":0.33,"checks":"passed","cargo_pass":603,"cargo_fail":1,"cargo_ignored":1,"failing_test":"interop::string_mod::tests::str_to_float_parses_float"},"status":"keep","description":"Added Crypto.sha256/1, Crypto.hmac_sha256/2, Crypto.random_bytes/1 stdlib module backed by sha2/hmac/rand crates with 13 focused unit tests.","timestamp":1774586594000,"segment":2}
{"run":32,"commit":"b7ff200","metric":70.0,"metrics":{"focused_checks_green":70,"focused_json_tests":13,"focused_toml_tests":11,"focused_shell_tests":12,"focused_datetime_tests":8,"focused_base64_tests":13,"focused_crypto_tests":13,"focused_http_tests":0,"display":"70/70 + Http wrapper","exit_code":0,"duration_seconds":0.32,"checks":"passed","cargo_pass":603,"cargo_fail":1,"cargo_ignored":1,"failing_test":"interop::string_mod::tests::str_to_float_parses_float"},"status":"keep","description":"Added Http.get/1-2, Http.post/2-3, Http.put/2-3, Http.patch/2-3, Http.delete/1-2, Http.request/4-5 as pure Tonic wrapper over existing sys_http_request host call.","timestamp":1774587388000,"segment":2}
{"run":33,"commit":"17c525b","metric":77.0,"metrics":{"focused_checks_green":77,"focused_json_tests":13,"focused_toml_tests":11,"focused_shell_tests":12,"focused_datetime_tests":8,"focused_base64_tests":13,"focused_crypto_tests":13,"focused_http_tests":0,"focused_uuid_tests":7,"display":"77/77","exit_code":0,"duration_seconds":0.34,"checks":"passed","cargo_pass":610,"cargo_fail":1,"cargo_ignored":1,"failing_test":"interop::string_mod::tests::str_to_float_parses_float"},"status":"keep","description":"Added Uuid.v4/0 stdlib module backed by rand crate with 7 focused unit tests for RFC 4122 UUID v4 generation.","timestamp":1774587409303,"segment":2}
{"run":34,"commit":"b5ace36","metric":88.0,"metrics":{"focused_checks_green":88,"focused_json_tests":13,"focused_toml_tests":11,"focused_shell_tests":12,"focused_datetime_tests":8,"focused_base64_tests":13,"focused_crypto_tests":13,"focused_http_tests":0,"focused_uuid_tests":7,"focused_yaml_tests":11,"display":"88/88","exit_code":0,"duration_seconds":0.34,"checks":"passed","cargo_pass":621,"cargo_fail":1,"cargo_ignored":1,"failing_test":"interop::string_mod::tests::str_to_float_parses_float"},"status":"keep","description":"Added Yaml.encode/1 and Yaml.decode/1 backed by serde_yaml with 11 focused unit tests.","timestamp":1774587858000,"segment":2}
{"run":35,"commit":"0e0de4d","metric":102.0,"metrics":{"focused_checks_green":102,"focused_json_tests":13,"focused_toml_tests":11,"focused_shell_tests":12,"focused_datetime_tests":8,"focused_base64_tests":13,"focused_crypto_tests":13,"focused_http_tests":0,"focused_uuid_tests":7,"focused_yaml_tests":11,"focused_env_tests":14,"display":"102/102","exit_code":0,"duration_seconds":0.35,"checks":"passed","cargo_pass":634,"cargo_fail":1,"cargo_ignored":1,"failing_test":"interop::string_mod::tests::str_to_float_parses_float"},"status":"keep","description":"Added Env.get/1-2, Env.fetch!/1, Env.set/2, Env.delete/1, Env.all/0, Env.has_key/1 stdlib module with 14 focused unit tests.","timestamp":1774588200000,"segment":2}
{"run":36,"commit":"12d2c40","metric":119.0,"metrics":{"focused_checks_green":119,"focused_json_tests":13,"focused_toml_tests":11,"focused_shell_tests":12,"focused_datetime_tests":8,"focused_base64_tests":13,"focused_crypto_tests":13,"focused_http_tests":0,"focused_uuid_tests":7,"focused_yaml_tests":11,"focused_env_tests":14,"focused_url_tests":17,"display":"119/119","exit_code":0,"duration_seconds":0.35,"checks":"passed","cargo_pass":651,"cargo_fail":1,"cargo_ignored":1,"failing_test":"interop::string_mod::tests::str_to_float_parses_float"},"status":"keep","description":"Added Url.encode/1, Url.decode/1, Url.encode_query/1, Url.decode_query/1 as host-backed stdlib functions with pure Rust RFC 3986 percent-encoding and 17 focused unit tests.","timestamp":1774589000000,"segment":2}
{"run":37,"commit":"07a6696","metric":132.0,"metrics":{"focused_checks_green":132,"focused_json_tests":13,"focused_toml_tests":11,"focused_shell_tests":12,"focused_datetime_tests":8,"focused_base64_tests":13,"focused_crypto_tests":13,"focused_http_tests":0,"focused_uuid_tests":7,"focused_yaml_tests":11,"focused_env_tests":13,"focused_url_tests":17,"focused_path_tests":14,"display":"132/132","exit_code":0,"duration_seconds":0.35,"checks":"passed","cargo_pass":656,"cargo_fail":1,"cargo_ignored":1,"failing_test":"interop::string_mod::tests::str_to_float_parses_float"},"status":"keep","description":"Extended Path module with rootname/1 and split/1 host-backed functions plus 5 new unit tests, bringing Path to 14 focused tests.","timestamp":1774589500000,"segment":2}
{"run":38,"commit":"cc93d47","metric":144.0,"metrics":{"focused_checks_green":144,"focused_json_tests":13,"focused_toml_tests":11,"focused_shell_tests":12,"focused_datetime_tests":8,"focused_base64_tests":13,"focused_crypto_tests":13,"focused_http_tests":0,"focused_uuid_tests":7,"focused_yaml_tests":11,"focused_env_tests":13,"focused_url_tests":17,"focused_path_tests":14,"focused_file_tests":12,"display":"144/144","exit_code":0,"duration_seconds":0.35,"checks":"passed","cargo_pass":668,"cargo_fail":1,"cargo_ignored":1,"failing_test":"interop::string_mod::tests::str_to_float_parses_float"},"status":"keep","description":"Added File.read/write/append/exists?/ls/ls_r/is_dir?/mkdir_p/rm_rf/cp/rename/stat stdlib module with 12 focused unit tests for cp/rename/stat host calls.","timestamp":1774590096000,"segment":2}
{"run":39,"commit":"d735016","metric":164.0,"metrics":{"focused_checks_green":164,"focused_json_tests":13,"focused_toml_tests":11,"focused_shell_tests":12,"focused_datetime_tests":8,"focused_base64_tests":13,"focused_crypto_tests":13,"focused_http_tests":0,"focused_uuid_tests":7,"focused_yaml_tests":11,"focused_env_tests":13,"focused_url_tests":17,"focused_path_tests":14,"focused_file_tests":12,"focused_math_tests":20,"display":"164/164","exit_code":0,"duration_seconds":0.33,"checks":"passed","cargo_pass":688,"cargo_fail":1,"cargo_ignored":1,"failing_test":"interop::string_mod::tests::str_to_float_parses_float"},"status":"keep","description":"Added Math stdlib module with pow/sqrt/abs/min/max/log/trig/ceil/floor/round plus pi/e constants, with 20 focused unit tests.","timestamp":1774591000000,"segment":2}
{"run":40,"commit":"db80268","metric":181.0,"metrics":{"focused_checks_green":181,"focused_json_tests":13,"focused_toml_tests":11,"focused_shell_tests":12,"focused_datetime_tests":8,"focused_base64_tests":13,"focused_crypto_tests":13,"focused_http_tests":0,"focused_uuid_tests":7,"focused_yaml_tests":11,"focused_env_tests":13,"focused_url_tests":17,"focused_path_tests":14,"focused_file_tests":12,"focused_math_tests":20,"focused_regex_tests":17,"display":"181/181","exit_code":0,"duration_seconds":0.38,"checks":"passed","cargo_pass":705,"cargo_fail":1,"cargo_ignored":1,"failing_test":"interop::string_mod::tests::str_to_float_parses_float"},"status":"keep","description":"Added Regex.match?/2, Regex.run/2, Regex.scan/2, Regex.replace/3, Regex.replace_all/3, Regex.split/2 as host-backed stdlib functions with 17 focused unit tests.","timestamp":1774591195000,"segment":2}
{"run": 41, "commit": "b711396", "metric": 192.0, "metrics": {"focused_checks_green": 192, "focused_json_tests": 13, "focused_toml_tests": 11, "focused_shell_tests": 12, "focused_datetime_tests": 8, "focused_base64_tests": 13, "focused_crypto_tests": 13, "focused_http_tests": 0, "focused_uuid_tests": 7, "focused_yaml_tests": 11, "focused_env_tests": 13, "focused_url_tests": 17, "focused_path_tests": 14, "focused_file_tests": 12, "focused_math_tests": 20, "focused_regex_tests": 17, "focused_random_tests": 11, "display": "192/192", "exit_code": 0, "duration_seconds": 0.35, "checks": "passed", "cargo_pass": 716, "cargo_fail": 1, "cargo_ignored": 1, "failing_test": "interop::string_mod::tests::str_to_float_parses_float"}, "status": "keep", "description": "Added Random.integer/2, Random.float/0, Random.boolean/0 as host-backed stdlib functions using rand crate with 11 focused unit tests.", "timestamp": 1774591678986, "segment": 2}
{"run":42,"commit":"e45ad99","metric":207.0,"metrics":{"focused_checks_green":207,"focused_json_tests":13,"focused_toml_tests":11,"focused_shell_tests":12,"focused_datetime_tests":8,"focused_base64_tests":13,"focused_crypto_tests":13,"focused_http_tests":0,"focused_uuid_tests":7,"focused_yaml_tests":11,"focused_env_tests":13,"focused_url_tests":17,"focused_path_tests":14,"focused_file_tests":12,"focused_math_tests":20,"focused_regex_tests":17,"focused_random_tests":11,"focused_logger_tests":15,"display":"207/207","exit_code":0,"duration_seconds":0.36,"checks":"passed","cargo_pass":731,"cargo_fail":1,"cargo_ignored":1,"failing_test":"interop::string_mod::tests::str_to_float_parses_float"},"status":"keep","description":"Added Logger.debug/info/warn/error/set_level/get_level stdlib module with host-backed level filtering and 15 focused unit tests.","timestamp":1774592400000,"segment":2}
{"run": 43, "commit": "19fd086", "metric": 207.0, "metrics": {"focused_checks_green": 207, "focused_json_tests": 13, "focused_toml_tests": 11, "focused_shell_tests": 12, "focused_datetime_tests": 8, "focused_base64_tests": 13, "focused_crypto_tests": 13, "focused_http_tests": 0, "focused_uuid_tests": 7, "focused_yaml_tests": 11, "focused_env_tests": 13, "focused_url_tests": 17, "focused_path_tests": 14, "focused_file_tests": 12, "focused_math_tests": 20, "focused_regex_tests": 17, "focused_random_tests": 11, "focused_logger_tests": 15, "focused_keyword_tests": 0, "display": "207/207", "exit_code": 0, "duration_seconds": 0.36, "checks": "passed", "cargo_pass": 731, "cargo_fail": 1, "cargo_ignored": 1, "failing_test": "interop::string_mod::tests::str_to_float_parses_float"}, "status": "discard", "description": "Pure Tonic Keyword module (get/fetch/put/delete/merge/take/drop/keys/values/to_map/keyword?) \u2014 no new focused tests.", "timestamp": 1774592942364, "segment": 2}
{"run":44,"commit":"83c386b","metric":224.0,"metrics":{"focused_checks_green":224,"focused_json_tests":13,"focused_toml_tests":11,"focused_shell_tests":12,"focused_datetime_tests":8,"focused_base64_tests":13,"focused_crypto_tests":13,"focused_http_tests":0,"focused_uuid_tests":7,"focused_yaml_tests":11,"focused_env_tests":13,"focused_url_tests":17,"focused_path_tests":14,"focused_file_tests":12,"focused_math_tests":20,"focused_regex_tests":17,"focused_random_tests":11,"focused_logger_tests":15,"focused_csv_tests":17,"display":"224/224","exit_code":0,"duration_seconds":0.37,"checks":"passed","cargo_pass":748,"cargo_fail":1,"cargo_ignored":1,"failing_test":"interop::string_mod::tests::str_to_float_parses_float"},"status":"keep","description":"Added Csv.decode/1, Csv.encode/1, Csv.decode_maps/1, Csv.encode_maps/2 with RFC 4180-compliant pure Rust parser/encoder and 17 focused unit tests.","timestamp":1774593600000,"segment":2}
{"run":45,"commit":"7c5de90","metric":239.0,"metrics":{"focused_checks_green":239,"focused_json_tests":13,"focused_toml_tests":11,"focused_shell_tests":12,"focused_datetime_tests":8,"focused_base64_tests":13,"focused_crypto_tests":13,"focused_http_tests":0,"focused_uuid_tests":7,"focused_yaml_tests":11,"focused_env_tests":13,"focused_url_tests":17,"focused_path_tests":14,"focused_file_tests":12,"focused_math_tests":20,"focused_regex_tests":17,"focused_random_tests":11,"focused_logger_tests":15,"focused_csv_tests":17,"focused_store_tests":15,"display":"239/239","exit_code":0,"duration_seconds":0.36,"checks":"passed","cargo_pass":763,"cargo_fail":1,"cargo_ignored":1,"failing_test":"interop::string_mod::tests::str_to_float_parses_float"},"status":"keep","description":"Added Store stdlib module (in-memory key-value store) with new/put/get/delete/has_key?/keys/values/size/to_list/clear/drop and 15 focused unit tests.","timestamp":1774594215000,"segment":2}
{"run":46,"commit":"c27f06f","metric":252.0,"metrics":{"focused_checks_green":252,"focused_json_tests":13,"focused_toml_tests":11,"focused_shell_tests":12,"focused_datetime_tests":8,"focused_base64_tests":13,"focused_crypto_tests":13,"focused_http_tests":0,"focused_uuid_tests":7,"focused_yaml_tests":11,"focused_env_tests":13,"focused_url_tests":17,"focused_path_tests":14,"focused_file_tests":12,"focused_math_tests":20,"focused_regex_tests":17,"focused_random_tests":11,"focused_logger_tests":15,"focused_csv_tests":17,"focused_store_tests":15,"focused_bitwise_tests":13,"display":"252/252","exit_code":0,"duration_seconds":0.36,"checks":"passed","cargo_pass":776,"cargo_fail":1,"cargo_ignored":1,"failing_test":"interop::string_mod::tests::str_to_float_parses_float"},"status":"keep","description":"Added Bitwise.band/bor/bxor/bnot/bsl/bsr stdlib module with i64 native ops and shift range validation, plus 13 focused unit tests.","timestamp":1774594800000,"segment":2}
{"run":47,"commit":"af8dbfd","metric":264.0,"metrics":{"focused_checks_green":264,"focused_json_tests":13,"focused_toml_tests":11,"focused_shell_tests":12,"focused_datetime_tests":8,"focused_base64_tests":13,"focused_crypto_tests":13,"focused_http_tests":0,"focused_uuid_tests":7,"focused_yaml_tests":11,"focused_env_tests":13,"focused_url_tests":17,"focused_path_tests":14,"focused_file_tests":12,"focused_math_tests":20,"focused_regex_tests":17,"focused_random_tests":11,"focused_logger_tests":15,"focused_csv_tests":17,"focused_store_tests":15,"focused_bitwise_tests":13,"focused_hex_tests":12,"display":"264/264","exit_code":0,"duration_seconds":0.35,"checks":"passed","cargo_pass":788,"cargo_fail":1,"cargo_ignored":1,"failing_test":"interop::string_mod::tests::str_to_float_parses_float"},"status":"keep","description":"Added Hex.encode/1, Hex.decode/1, Hex.encode_upper/1 with pure Rust byte-to-nibble conversion and 12 focused unit tests.","timestamp":1774595400000,"segment":2}
